{
  "schema_version": "0.2.0-draft",
  "snapshot_id": "wps-aippt__2026-09-06",
  "product_id": "wps-aippt",
  "name": "WPS AiPPT",
  "provider": "Kingsoft Office",
  "kind": "end_user_product",
  "canonical_url": "https://ppt.wps.cn/",
  "observed_at": "2026-09-06T00:00:00Z",
  "status": "queued",
  "facts": {}
}

